Timestamp,"Enter your Prolific ID.

*Note: If this value is automatically filled, do not edit it. Otherwise, input your Prolific ID (required for payment).","Instructions:

1. Complete all questions in this survey.

2. At the end of the survey, you will be provided with a code which you must enter in Prolific. You will have to manually go back to Prolific to enter this code.

3. Ensure that you submit the survey and that a confirmation page appears stating that your response has been submitted. This is a requirement for payment.

Do you understand these instructions?","We will be collecting some sensitive or protected user profile data points, such as age and gender identity, with additional questions on personal interests in politics, culture, profession, and religion.

This data will be used to measure the quantity of social interactions by presenting user profiles to other survey participants. This data will be available publicly, but all identifiable characteristics of the survey participants will be anonymized. 

Please contact the researchers if you would like your data to be deleted. We will handle your data according to the data protection laws of the United States, including California Consumer Privacy Act (CCPA).

Disclosure: All information collected during the study will used solely for research purposes. Participation is voluntary, and you may withdraw at any time without penalty.

Do you consent to the parameters provided above?","You and this individual both receive a notification that you two should connect.

Given the scenario above, would you choose to:",What aspect(s) of the person or the scenario motivated your decision?,"You and this individual both receive a notification that you two should connect.

Given the scenario above, would you choose to:",What aspect(s) of the person or the scenario motivated your decision?,"You and this individual both receive a notification that you two should connect.

Given the scenario above, would you choose to:",What aspect(s) of the person or the scenario motivated your decision?,"You and this individual both receive a notification that you two should connect.

Given the scenario above, would you choose to:",What aspect(s) of the person or the scenario motivated your decision?,"You and this individual both receive a notification that you two should connect.

Given the scenario above, would you choose to:",What aspect(s) of the person or the scenario motivated your decision?,"You and this individual both receive a notification that you two should connect.

Given the scenario above, would you choose to:",What aspect(s) of the person or the scenario motivated your decision?,"The Prolific code for this study is C7AO3V83.

Please copy and paste the above code into Prolific to prove that you completed this study, and submit this survey."
4/22/2024 20:59:38,6606e93fbb8cbe12379ec72e,Yes.,I consent.,Chat (via instant messaging),"No matter what the person looks like or what their demographics are, I will always choose to chat via instant messaging first to gage whether or not we are compatible.",Reject,"If this erson is with more than six other people, I don't trust that she is an introvert. ",Chat (via instant messaging),They seem to be introverted since they are  in a group but only listening... which I am attracted to in a friend.,Reject,She seems too outgoing for my liking.,Chat (via instant messaging),He sounds like an introvert for sure. I wouldn't mind getting to know him through chat first. ,Chat (via instant messaging),"He seems like a nice person. Introverted, likes hiking, classic rock... I would definitely want to get to know him.",Select this option if you will enter the code in Prolific and submit this survey.